Title,Original Title,Subtitle,Series,Volume,Author,"Author (Last, First)",Illustrator,Narrator,Translator,Photographer,Editor,Publisher,Place of Publication,Date Published,Year Published,Original Date Published,Original Year Published,Edition,Genre,Summary,Guided Reading Level,Lexile Measure,Lexile Code,Grade Level Equivalent,Developmental Reading Assessment,Interest Level,AR Level,AR Points,AR Quiz Number,Word Count,Number of Pages,Format,Audio Runtime,Dimensions,Weight,List Price,Language,Original Language,DDC,LCC,LCCN,OCLC,ISBN,ISSN,Favorites,Rating,Physical Location,Status,Status Incompleted Reason,Status Hidden,Date Started,Date Finished,Current Page,Loaned To,Date Loaned,Borrowed From,Date Borrowed,Returned from Borrow,Not Owned Reason,Quantity,Condition,Recommended By,Date Added,User Supplied ID,User Supplied Descriptor,Tags,Purchase Date,Purchase Place,Purchase Price,Notes,Google VolumeID,Category,Wish List,Previously Owned,Up Next,Position,Uploaded Image URL,Activities
1984,,,,,George Orwell,"Orwell, George",,,,,,Bur Rizzoli,,,2021,,,,,,,,,,,,,,,,,,,,,,italiano,,,,,,9788817154857,,0,0.000000,,Unread,,0,,,,,,,,0,,,,,2024/10/24 19:58:12.996476054,,,,,,,,,Personale,0,0,0,,http://images.amazon.com/images/P/8817154857.01Z.jpg,
Fuori di zucca,,,,,Sue Townsend,"Townsend, Sue",,,,,,Sperling & Kupfer,,,1990,,,,Fiction,,,,,,,,,,,,272,,,,,,italiano,,,,,,9788820010898,,0,0.000000,,Unread,,0,,,,,,,,0,,,,,2024/11/01 23:01:16.463719964,,,,,,,,e7i9AAAACAAJ,,0,0,0,,https://s3.amazonaws.com/kimicoapps-bookbuddy/EBD0E094-DE5F-4E14-B454-BFA3542C9386,
Galleria Colonna,,Elenco dipinti - Cenni storici,,,Sconosciuto,Sconosciuto,,,,,,Galleria Colonna,,,,,,,Art,,,,,,,,,,,,32,,,,,,,,,,,,,,0,0.000000,,Unread,,0,,,,,,,,0,,,,,2024/11/02 00:33:50.065693974,,,,,,,,,Personale,0,0,0,,https://s3.amazonaws.com/kimicoapps-bookbuddy/07C33A05-2C04-43D1-BD77-D7F0BBDD3E36,
Grand tour d'Italia a piccoli passi,,,,,Philippe Daverio,"Daverio, Philippe",,,,,,Rizzoli,,,2022,,,,Art,,,,,,,,,,,,,,,,,,italiano,,,,,,9788891837479,,0,0.000000,,Unread,,0,,,,,,,,0,,,,,2024/10/31 12:01:44.135360002,,,,,,,,,Personale,0,0,0,,http://images.amazon.com/images/P/8891837474.01Z.jpg,
I maestri del colore Botticelli,,,,,Mina Bacci,"Bacci, Mina",,,,,,Fratelli Fabbri Editori,,,,,,,Art,,,,,,,,,,,,16,,,,,,,,,,,,,,0,0.000000,,Unread,,0,,,,,,,,0,,,,,2024/11/02 00:28:04.825682997,,,,,,,,,Personale,0,0,0,,https://s3.amazonaws.com/kimicoapps-bookbuddy/F839588B-307C-4CEB-8B7F-C0198421C3B1,
Il Palazzo del Quirinale,,"La storia, le sale e le collezioni",,,Vari,Vari,,,,,,Fondazione Marilena Ferrari,,,,,,,Art,,,,,,,,,,,,271,,,,,,,,,,,,,,0,0.000000,,Unread,,0,,,,,,,,0,,,,,2024/11/02 00:19:57.731068015,,,,,,,,,Personale,0,0,0,,https://s3.amazonaws.com/kimicoapps-bookbuddy/B37D38CC-4E47-40E6-A276-84A3343DD325,
Immaginare le storie,,atlante visuale per scrittrici e scrittori,,,"Giulio Mozzi,Valentina Durante","Mozzi, Giulio",,,,,,Johan & Levi editore,,,2022,,,,Art,"Perché una storia si metta in moto a volte è sufficiente che una certa immagine compaia nella mente dello scrittore con un'insistenza ossessiva. Viceversa, a far inceppare la macchina narrativa basta una minima défaillance della capacità di escogitare personaggi e situazioni. Questo libro, pensato da una scrittrice e uno scrittore per altre scrittrici e altri scrittori, viene allora in soccorso a chi vuole potenziare la propria immaginazione cercando ispirazione nelle immagini prodotte dagli altri. Le opere d'arte - ma, allargando lo sguardo all'intero campo del visivo, anche l'architettura e il design, i fotogrammi e le pubblicità - non sono oggetti da contemplare passivamente. Sono immagini che ci interpellano, che ci coinvolgono, alle quali reagiamo con tutti i nostri sensi e i nostri pensieri, che contribuiscono a espandere quel corredo sensoriale che è il bagaglio minimo di ogni scrittore. Il quale, a differenza del critico d'arte, ha il vantaggio di potervisi accostare in modo spregiudicato ed estemporaneo, non già per decifrarle e commentarle ma per ricavarne ciò che hanno da offrire alla causa della scrittura. Forti della loro lunga pratica di insegnamento, Giulio Mozzi e Valentina Durante ci accolgono nella loro ""bottega di narrazione"" e ci guidano alla scoperta di come l'immaginario visuale possa diventare uno strumento eccezionalmente utile alla comprensione intuitiva di aspetti della narrazione quali il narratore, i dialoghi, la trama, lo stile, il montaggio. Del resto, se le opere d'arte sono fatte da persone che hanno dimostrato un certo talento nell'affrontare e risolvere dilemmi progettuali assai simili a quelli che affliggono chi è bloccato davanti al foglio bianco, imparare dai loro sguardi allenati è il migliore punto di partenza per costruire scene e intrecci più vividi e suggestivi, capaci di conquistare l'occhio interno del lettore.",,,,,,,,,,,191,,,,,,italiano,,,,,,9788860103246,,0,0.000000,,Unread,,0,,,,,,,,0,,,,,2024/10/24 15:23:58.163691997,,,,,,,,ZC11zwEACAAJ,Professionale,0,0,0,,,
Kafka,,,,,Pietro Citati,"Citati, Pietro",,,,,,Adelphi,,,2007,,,,Literature,,,,,,,,,,,,,,,,,,italiano,,,,,,9788845922114,,0,0.000000,,Unread,,0,,,,,,,,0,,,,,2024/10/25 10:36:38.040477037,,,,,,,,,Personale,0,0,0,,http://images.amazon.com/images/P/8845922111.01Z.jpg,
Lettere a Theo,,,,,"Vincent Van Gogh,Massimo Cescon (A cura di)","Gogh, Vincent Van",,,,,,Guanda,,,2022,,,,Art,"""Caro Theo"": per molto tempo, dall'agosto 1872 fino al 27 luglio 1890, due giorni prima di morire dopo essersi sparato un colpo di rivoltella, Vincent Van Gogh scrisse al fratello Theo con una costanza che trova il solo termine di paragone nell'amore che egli nutriva per lui. Per molto tempo Theo fu il suo unico interlocutore; sempre fu quello privilegiato, il solo cui confidò le pene della mente e del cuore. Del resto, le lettere a Theo (qui presentate in una scelta che riprende, con qualche variante, la versione integrale apparsa in Italia nel 1959) costituiscono la gran parte dell'epistolario vangoghiano. Dalla giovinezza alla piena maturità, esse ci permettono di seguire, quasi quotidianamente, la vicenda artistica e umana del grande pittore.",,,,,,,,,,,416,,,,,,italiano,,,,,,9788823531185,,0,0.000000,,Unread,,0,,,,,,,,0,,,,,2024/10/31 11:37:21.615612983,,,,,,,,t0EtzwEACAAJ,Personale,0,0,0,,,
Oliva Denaro,,,,,Viola Ardone,"Ardone, Viola",,,,,,Giulio Einaudi Editore,,2021/09/28,2021,,,,Fiction,"«Io non lo so se sono favorevole al matrimonio. Per questo in strada vado sempre di corsa: il respiro dei maschi è come il soffio di un mantice che ha mani e può arrivare a toccare le carni».È il 1960, Oliva Denaro ha quindici anni, abita in un paesino della Sicilia e fin da piccola sa - glielo ripete ossessivamente la madre - che «la femmina è una brocca, chi la rompe se la piglia». Le piace studiare e imparare parole difficili, correre «a scattafiato», copiare di nascosto su un quaderno i volti delle stelle del cinema (anche se i film non può andare a vederli, perché «fanno venire i grilli per la﻿ testa»), cercare le lumache con il padre, tirare pietre con la fionda a chi schernisce il suo amico Saro. Non le piace invece l'idea di avere «il marchese», perché da quel momento in poi queste cose non potrà piú farle, e dovrà difendersi dai maschi per arrivare intatta al matrimonio. Quando il tacito sistema di oppressione femminile in cui vive la costringe ad accettare un abuso, Oliva si ribella e oppone il proprio diritto di scelta, pagando il prezzo di quel no. Viola Ardone sa trasformare magnificamente la Storia in storia raccontando le contraddizioni dell'amore, tra padri e figlie, tra madri e figlie, e l'ambiguità del desiderio, che lusinga e spaventa, soprattutto se è imposto con la forza. La sua scrittura scandaglia la violenza dei ruoli sociali, che riguarda tutti, uomini compresi. Se Oliva Denaro è un personaggio indimenticabile, quel suo padre silenzioso, che la lascia decidere, con tutto lo smarrimento che dover decidere implica per lei, è una delle figure maschili piú toccanti della recente narrativa italiana.",,,,,,,,,,,312,,,,,,italiano,,,,,,9788858437353,,0,4.000000,,Read,,0,,2024/10/24,,,,,,0,,,,,2024/10/24 17:06:04.507194995,,,,,,,"«La femmina è una brocca: chi la rompe se la piglia, così dice mia madre».
Incipit «di testa», da cui sgorga, prodigiosa, tutta la profondità di #olivadenaro, scritto da #violaardone, edito da #einaudi.
Il romanzo è liberamente ispirato a una vicenda realmente accaduta in Sicilia negli anni Sessanta, che ha assunto rilievo iconico nella lotta per l’emancipazione femminile.
Attraverso uno stile che, per quanto asciutto e scorrevole, riesce a incidere con efficacia evocativa, toccando quasi i sensi prima che l’immaginario, la narrazione incede con un ritmo incalzante, a volte «sfrontatamente» coinvolgente, da una prospettiva interna, che disvela, in maniera vibrante, un universo di sentimenti, emozioni e inclinazioni con cui non si può fare a meno di empatizzare: chi legge si fonde con Oliva Denaro; Oliva Denaro diventa una qualunque di noi e la sua voce diviene tanto più potente quanto più affonda nelle vastità intimistiche dell’introspezione.
La struttura del romanzo è solida, la scelta di far coincidere la voce narrante con quella della protagonista ben vale la difficoltà di incanalare i fatti narrati nel flusso imposto da questo particolare filtro ed è molto ben affrontata. I personaggi sono costruiti in maniera realistica e toccante. In particolare spicca il padre di Oliva, figura di sublime delicatezza e, al tempo stesso, di invacillabile fermezza. I suoi calibrati silenzi, i suoi limpidi «non lo preferisco», i suoi fatti concludenti plasmano uno splendido rapporto padre-figlia, che è la radice ultima del coraggio di Oliva. Luminosa la scelta, nell’epilogo, di affidare la narrazione alternativamente alla voce di Oliva e a quella del padre, in un toccante, implicito dialogo tra i due.
Unico neo è l’imperfetta ricerca lessicale, che, per amore di autenticità, avrebbe richiesto una più matura contaminazione del linguaggio col dialetto siciliano. Perché il ricorrente «piccinna» in luogo del più realistico siciliano «picciridda»? Si avverte altresì la mancanza di costrutti sintattici tipici del dialetto siciliano che è quasi impossibile non sentire affiorare nel linguaggio non dialettale di chi con quel dialetto abbia, per origine, consuetudine e familiarità.",-iREEAAAQBAJ,Personale,0,0,0,,"https://m.media-amazon.com/images/I/71vhZARiJOL._AC_UF1000,1000_QL80_.jpg","[{""status"":0,""activityYear"":2024,""param1"":""0"",""param2"":""2"",""param3"":"""",""contact"":"""",""comments"":"""",""deviceName"":""iPhone di Dorella"",""type"":12,""addedDate"":""2024\/10\/24 17:06:04.529013037"",""activityDate"":""2024\/10\/24""}]"
Quer pasticciaccio brutto de via Merulana,,,,,Carlo Emilio Gadda,"Gadda, Carlo Emilio",,,,,,Adelphi,,,2023,,,,Fiction,"Nel giro di pochi giorni, nel marzo del 1927, un furto di denaro e gioielli ai danni di una svaporata e fantasiosa vedova, la contessa Menegazzi, e poi l'omicidio della ricca, splendida e malinconica Liliana Balducci, sgozzata con ferocia inaudita, incrinano la decorosa quiete di un grigio palazzo abitato da pescecani, in via Merulana, come se una «vampa calda, vorace, avventatasi fuori dall'inferno» l'avesse d'improvviso investito - una vampa di cupidigia e brutale passione. Indaga su entrambi i casi, forse collegati, Francesco Ingravallo, perspicace commissario-filosofo e segreto ammiratore di Liliana: ma la sua livida, rabbiosa determinazione, il suo prodigioso intuito per il «quanto di erotia» che ogni delitto nasconde e le pressioni di chi pretende a ogni costo un colpevole da dare in pasto alla «moltitudine pazza» non basteranno ad aver ragione del disordine e del Male. L'inchiesta sui torbidi misteri del «palazzo dell'Oro» gli concederà, al più, la medesima, lacerante cognizione del dolore di Gonzalo Pirobutirro. Giallo abnorme, temerario, enigmatico, frutto della irresistibile attrazione che su Gadda esercitavano il romanzo e i crimini tenebrosi ma insieme di una tensione conoscitiva che finisce per travolgere ogni possibile plot, il Pasticciaccio è anche il ritratto di una città e di una nazione degradate dalla follia narcisistica del Tiranno, dove si riversa a ondate tumultuose una realtà perturbata e molteplice - e dove, a rappresentarla, sono convocate, in uno sforzo immane, tutte le risorse della nostra lingua, dei dialetti, delle scienze e delle tecniche.",,,,,,,,,,,370,,,,,,italiano,,,,,,9788845937644,,0,0.000000,,Unread,,0,,,,,,,,0,,,,,2024/10/25 10:35:04.251338958,,,,,,,,_tefzwEACAAJ,Personale,0,0,0,,,
Vincent Van Gogh,,1853-1890 visione e realtà,,,Info F. Walter,"Walter, Info F.",,,Adele Autuori-Drude,,,Benefit Taschen,,,,,,,Art,,,,,,,,,,,,95,,,,,,,,,,,,,,0,5.000000,,Unread,,0,,,,,,,,0,,,,,2024/11/02 00:24:47.823904037,,,,,,,,,Personale,0,0,0,,https://s3.amazonaws.com/kimicoapps-bookbuddy/F9EA22D8-D5C9-4825-A9C2-375E03749754,
Barbaglio D’Argento E Altri Casi Raccontati In «Le Avventure Di Sherlock Holmes»,,,The Strand Magazine - The Sherlock Holmes Collection,,Arthur Conan Doyle,"Doyle, Arthur Conan",,,Nicoletta Rosati Bizzotto,,,,,,,,1892,,Mistery-Crime,,,,,,,,,,,,249,,,,,,,,,,,,,,0,0.000000,Sez. 1 Scaf. 7 Fila Ant.,Unread,,0,,,,,,,,0,,,,,2024/12/10 14:52:10.890535950,,,,,,,,,Personale,0,0,0,,https://s3.amazonaws.com/kimicoapps-bookbuddy/0E3D25D7-FD4E-41A2-872D-9A8A76CDC85D,
Il carbonchio azzurro,,,The Strand Magazine - The Sherlock Holmes Collection,,Arthur Conan Doyle,"Doyle, Arthur Conan",,,,,,RBA,,,,,1892,,Mistery-Crime,,,,,,,,,,,,285,,,,,,italiano,,,,,,,,0,0.000000,Sez. 1 Scaf. 7 Fila Ant.,Unread,,0,,,,,,,,0,,,,,2024/10/24 18:09:09.681427955,,,,,,,,,Personale,0,0,0,,https://s3.amazonaws.com/kimicoapps-bookbuddy/8ECC7D4B-A03C-42F2-BDC8-F1A244A04ADD,
Il mastino dei Baskerville,,,The Strand Magazine - The Sherlock Holmes Collection,,Arthur Conan Doyle,"Doyle, Arthur Conan",,,,,,RBA,,,,,1901,,Mistery-Crime,,,,,,,,,,,,316,,,,,,italiano,,,,,,,,0,0.000000,Sez. 1 Scaf. 7 Fila Ant.,Unread,,0,,,,,,,,0,,,,,2024/10/24 18:21:47.140061974,,,,,,,,,Personale,0,0,0,,https://s3.amazonaws.com/kimicoapps-bookbuddy/827FB51A-03BC-4FD4-A37B-2829C8EF09A2,
Il Problema Finale E Altri Casi Raccontati In «Le Memorie Di Sherlock Holmes»,,,The Strand Magazine - The Sherlock Holmes Collection,,Arthur Conan Doyle,"Doyle, Arthur Conan",,,Nicoletta Rosati Bizzotto,,,RBA,,,,,1893,,Mistery-Crime,,,,,,,,,,,,264,,,,,,,,,,,,,,0,0.000000,Sez. 1 Scaf. 7 Fila Ant.,Unread,,0,,,,,,,,0,,,,,2024/12/10 15:05:14.455927014,,,,,,,,,Personale,0,0,0,,https://s3.amazonaws.com/kimicoapps-bookbuddy/BA7347AA-9E32-4271-A89D-7E3979D609A0,
Il segno dei quattro,,,The Strand Magazine - The Sherlock Holmes Collection,,Arthur Conan Doyle,"Doyle, Arthur Conan",,,,,,RBA,,,,,1890,,Mistery-Crime,,,,,,,,,,,,,,,,,,italiano,,,,,,,,0,3.500000,Sez. 1 Scaf. 7 Fila Ant.,Read,,0,,2024/11/01,,,,,,0,,,,,2024/10/24 18:32:58.101623058,,,,,,,,,Personale,0,0,0,,https://s3.amazonaws.com/kimicoapps-bookbuddy/4A6067D2-5078-40E6-99C9-F4045C7E3334,"[{""status"":0,""activityYear"":2024,""param1"":""0"",""param2"":""2"",""param3"":"""",""contact"":"""",""comments"":"""",""deviceName"":""iPhone di Dorella"",""type"":12,""addedDate"":""2024\/11\/01 20:14:55.376744985"",""activityDate"":""2024\/11\/01""}]"
La pietra di Mazarino e altri casi tratti da «Il taccuino di Sherlock Holmes»,,,The Strand Magazine - The Sherlock Holmes Collection,,Arthur Conan Doyle,"Doyle, Arthur Conan",,,Nicoletta Rosati Bizzotto,,,RBA,,,,,1921,,Mistery-Crime,,,,,,,,,,,,237,,,,,,,,,,,,,,0,0.000000,Sez. 1 Scaf. 7 Fila Ant.,Unread,,0,,,,,,,,0,,,,,2024/12/26 10:59:58.577731013,,,,,,,,,Personale,0,0,0,,https://s3.amazonaws.com/kimicoapps-bookbuddy/CA2208A5-431C-4E9B-9BCC-EE2C195F144B,
La valle della paura,,,The Strand Magazine - The Sherlock Holmes Collection,,Arthur Conan Doyle,"Doyle, Arthur Conan",,,Nicoletta Rosati Bizzotto,,,RBA,,,,,1914,,Mistery-Crime,,,,,,,,,,,,302,,,,,,,,,,,,,,0,0.000000,Sez. 1 Scaf. 7 Fila Ant.,Unread,,0,,,,,,,,0,,,,,2024/12/26 10:56:06.324061989,,,,,,,,,Personale,0,0,0,,https://s3.amazonaws.com/kimicoapps-bookbuddy/CDF8FE31-1F0B-4BCB-A7E5-CB7AEB5E2C97,
Three Gables e altri casi raccolti in «Il taccuino di Sherlock Holmes»,,,The Strand Magazine - The Sherlock Holmes Collection,,Arthur Conan Doyle,"Doyle, Arthur Conan",,,Nicoletta Rosati Bizzotto,,,RBA,,,,,1926,,Mistery-Crime,,,,,,,,,,,,206,,,,,,,,,,,,,,0,0.000000,Sez. 1 Scaf. 7 Fila Ant.,Unread,,0,,,,,,,,0,,,,,2024/12/26 11:03:26.885558962,,,,,,,,,Personale,0,0,0,,https://s3.amazonaws.com/kimicoapps-bookbuddy/687B078C-A1B9-4D26-BA99-4E6ED2F47065,
Uno scandalo in Boemia,,,The Strand Magazine - The Sherlock Holmes Collection,,Arthur Conan Doyle,"Doyle, Arthur Conan",,,,,,RBA,,,,,1891,,Mistery-Crime,,,,,,,,,,,,278,,,,,,italiano,,,,,,,,0,0.000000,Sez. 1 Scaf. 7 Fila Ant.,Unread,,0,,,,,,,,0,,,,,2024/10/24 18:06:15.527730941,,,,,,,,,Personale,0,0,0,,https://s3.amazonaws.com/kimicoapps-bookbuddy/A559FCAB-BFF8-46A7-9F40-DFF528F32533,
Uno studio in rosso,,,The Strand Magazine - The Sherlock Holmes Collection,,Arthur Conan Doyle,"Doyle, Arthur Conan",,,,,,RBA,,,,,1887,,Mistery-Crime,,,,,,,,,,,,247,,,,,,italiano,,,,,,,,0,4.000000,Sez. 1 Scaf. 7 Fila Ant.,Read,,0,,2024/10/24,,,,,,0,,,,,2024/10/24 18:04:02.298560976,,,,,,,,,Personale,0,0,0,,https://s3.amazonaws.com/kimicoapps-bookbuddy/23D61301-5B3A-48F4-AC7B-7351B9127511,"[{""status"":0,""activityYear"":2024,""param1"":""0"",""param2"":""2"",""param3"":"""",""contact"":"""",""comments"":"""",""deviceName"":""iPhone di Dorella"",""type"":12,""addedDate"":""2024\/10\/24 18:04:02.347005963"",""activityDate"":""2024\/10\/24""}]"
Ascoltami,,,Le investigatrici,24,Tess Gerritsen,"Gerritsen, Tess",,,Sarà Crimi e Laura Tasso,,,Oggi,,,,,,,Crime,"Sofia Suarez, vedova tranquilla, infermiera amabile, vicina apprezzata da tutto il quartiere è stata assassinata a colpi di martello. Chi è stato? E perché? Se lo chiedono la detective della Omicidi di Boston Jane Rizzoli e il medico legale Maura Isles. Chi avrebbe potuto avercela con quella donna così mite e benvoluta? Nessuna pista sembra promettente, così Jane e Maura iniziano a scavare nel passato di Sofia, che si rivelerà essere diverso da quel che pareva... Nel frattempo Angela Riz-
zoli, madre di Jane che, oltre al sangue, condivide con la figlia il talento di percepire il pericolo prima di chiunque altro, ha la netta sensazione che dei semplici pettegolezzi che girano nel quartiere nascondano in realtà qualcosa di inquietante: i nuovi inquilini dell'appartamento di fronte, la ragazza fuggita dalla casa in fondo all'isolato e altri piccoli eventi potrebbero essere collegati tra loro. Jane fatica a credere alle congetture della madre, nota per la sua fervida immaginazione e il gusto per la tragedia. E così Angela si ritroverà a indagare da sola sui vicini, temendo che tra loro ci sia un lupo in agguato, mentre Jane e Maura, assorbite dal loro caso, rischiano di non udire in tempo le sue grida di avvertimento...",,,,,,,,,,,302,,,,,,,,,,,,,,0,0.000000,Sez. 1 Scaf. 7 Fila Post.,Unread,,0,,,,,,,,0,,,,,2024/10/31 15:49:09.393039941,,,,,,,,,Personale,0,0,0,,https://s3.amazonaws.com/kimicoapps-bookbuddy/0E1D6620-484B-4DB7-A088-20483C5D314A,
Aurora nel buio,,,Le investigatrici,11,Barbara Baraldi,"Baraldi, Barbara",,,,,,Oggi e Giunti,,,,,,,Crime,"Aurora Scalviati era la migliore, fino al giorno di quel conflitto a fuoco, quando un proiettile ha raggiunto la sua testa. Da allora, la più brava profiler della polizia italiana sofire di un disturbo bipolare che cerca di dominare attraverso i farmaci e le sedute clandestine di una terapia da molti considerata bar-bara: l'elettroshock. Quando per motivi disciplinari Aurora viene trasferita in una tranquilla cittadina dell'Emilia, si trova di fronte a uno scenario diverso da come lo immaginava. Proprio la notte del suo arrivo, una donna viene uccisa. Il marito è scomparso e l'assassino ha rapito la loro bambina, Aprile, di nove anni. Su una parete della casa, una scritta tracciata col sangue della vittima: «Tu non farai alcun male». Aurora è certa che si tratti dell'opera di un killer che ha già ucciso in passato e che quella scritta sia un indizio che può condurre alla bimba, una specie di ultimatum... Ma nessuno la ascolta.
Presto Aurora capirà di dover agire al di fuori delle regole, perché solo fidandosi del proprio intuito potrà dissipare la coltre di nebbia che avvolge ogni cosa. Solo affrontando i demoni della propria mente potrà salvare la piccola Aprile ed
evitare nuove morti...",,,,,,,,,,,463,,,,,,,,,,,,,,0,0.000000,Sez. 1 Scaf. 7 Fila Post.,Unread,,0,,,,,,,,0,,,,,2024/10/30 23:37:22.113754987,,,,,,,,,Personale,0,0,0,,https://s3.amazonaws.com/kimicoapps-bookbuddy/CB874932-AC68-441B-8ADD-2C0219C83315,
Come piante tra i sassi,,,Le investigatrici,9,Mariolina Venezia,"Venezia, Mariolina",,,,,,Oggi,,,,,,,Crime,"Nella quiete sorniona di un sabato mattina in ufficio, mentre Matera si prepara al rituale dello struscio pomeridiano, una telefonata raggiunge il Sostituto Procuratore Imma Tataran-ni. ""Pensò immediatamente a Valentina, che doveva essere appena uscita da scuola e in quei giorni stava piantando una grana. Invece le dissero che avevano ucciso un ragazzo, a Nova Siri"". Imma per mestiere ha a che fare abitualmente coi morti ammazzati; ma se a morire è un coetaneo di sua figlia, a poco a poco la madre e il procuratore si scopriranno facce della stessa medaglia che finiranno per confondersi e alimentarsi l'un l'altra. L'indagine del procuratore - con le sue tecniche, le sue dinamiche, le rivalità antiche e nuove - pagina dopo pagina assume infatti i contorni del viaggio di una madre alla scoperta di un mistero più importante e profondo: chi sono i nostri figli, che cosa vogliono, che possibilità hanno di questi tempi? In una comunità chiusa del Mezzogiorno italiano, fra dicerie superficiali e misfatti sepolti dalla terra arsa dal sole, Imma scru-ta, interroga, immagazzina dati: qualche volta inciampa, come sugli irrinunciabili tacchi alti, qualche volta, proprio come con quelli, riesce a ergere lo sguardo oltre l'apparenza dei fatti.",,,,,,,,,,,237,,,,,,,,,,,,,,0,3.500000,Sez. 1 Scaf. 7 Fila Post.,Read,,0,,2024/10/30,,,,,,0,,,,,2024/10/30 23:15:14.152547955,,,,,,,,,Personale,0,0,0,,https://s3.amazonaws.com/kimicoapps-bookbuddy/B9E43406-4156-49A4-8306-DC5A72F4AFA8,"[{""status"":0,""activityYear"":2024,""param1"":""0"",""param2"":""2"",""param3"":"""",""contact"":"""",""comments"":"""",""deviceName"":""iPhone di Dorella"",""type"":12,""addedDate"":""2024\/10\/30 23:15:14.164994001"",""activityDate"":""2024\/10\/30""}]"
Dieci piccoli indizi,,,Le investigatrici,29,Joy Ellis,"Ellis, Joy",,,Micol Cerato,,,Oggi,,,,,,,Crime,"Nikki Galena è una detective in gamba, ma non gioca secondo le regole. Di certo non quando ha a che fare con i malviventi responsabili di aver ridotto in fin di vita sua figlia. È anche una donna solitaria, per niente brava nel gioco di squadra. E invece è costretta a lavorare in coppia con Joseph Easter, l'ultimo arrivato alla Centrale, preceduto da una pessima reputazione.
Insieme dovranno affrontare due casi apparentemente sem-plici, destinati però a mettere a dura prova le loro abilità di investigatori. La città è infatti terrorizzata da gruppi violenti che indossano delle maschere: a Galena e Easter il compito di sventare quei balordi. Ma quello che con grande fatica riusciranno a scoprire avrà il volto dell'orrore. Un incubo al di là di ogni possibile immaginazione...",,,,,,,,,,,317,,,,,,,,,,,,,,0,0.000000,Sez. 1 Scaf. 7 Fila Post.,Unread,,0,,,,,,,,0,,,,,2024/10/31 17:17:41.254454016,,,,,,,,,Personale,0,0,0,,https://s3.amazonaws.com/kimicoapps-bookbuddy/4F31E68F-520E-43CD-B6A3-F776509C6E6C,
Gli onori di casa,,,Le investigatrici,6,Alicia Giménez-Bartlett,"Giménez-Bartlett, Alicia",,,Maria Nicola,,,Oggi,,,,,,,Crime,"L'ispettrice Petra Delicado e il suo aiutante Fermín Garzón sono in trasferta a Roma. È stata riaperta una vecchia indagine le cui tracce portano proprio in Italia. I due sono ben contenti della novità. Si tratta di una storia che parte da lontano: un facoltoso imprenditore di Barcellona, Adolfo Siguan, con un debole per le giovani prostitute, rimane vittima di una coppia diabolica, che lo narcotizza per svaligiargli l'appartamento e finisce per ucciderlo sfondandogli la testa. Con l'arresto di Julieta, la ragazza che ha adescato Adolfo, e la morte violenta del suo protettore, il caso pare ormai chiuso, anche se la ragazza giura che non è stato il suo uomo a commettere il delitto ma un misterioso italiano scomparso nel nulla. Passano cinque anni. L'ancor giovane vedova della vittima, che non è mai stata persuasa dall'esito delle indagini, ottiene la riapertura del caso. E qui che entrano in azione Petra e Fermín, che dopo avere fortunosamente rintracciato l'ex prostituta Julieta, ormai riabilitata e uscita di prigione, riescono a farsi rivelare il nome dell'italiano. Sbarcati a Fiumicino, si ritrovano affiancati da due pari grado: un ispettore di Polizia e la sua giovane assistente. L'indagine è più intricata del previsto, piena di avventure e con un drammatico colpo di scena: Petra questa volta rischia davvero.",,,,,,,,,,,383,,,,,,,,,,,,,,0,0.000000,Sez. 1 Scaf. 7 Fila Post.,Unread,,0,,,,,,,,0,,,,,2024/10/30 23:05:17.770020961,,,,,,,,,Personale,0,0,0,,https://s3.amazonaws.com/kimicoapps-bookbuddy/2BDDC29F-5302-4448-86A4-55C8413843FC,
